{
  "schema_version": "1.0",
  "dataset_snapshot_id": "ds-scan_clean",
  "subject_ref": "subject-synthetic-\u2014stage03-001",
  "created_at": "2026-09-14T06:00:00Z",
  "verification_status": "unverified",
  "source_documents": [
    {
      "schema_version": "1.0",
      "document_id": "doc-scan_clean",
      "media_type": "application/pdf",
      "integrity": {
        "sha256": "acc6c3ddb4c006706ffd75bcf66aad24115d604dc706a0b5b5d5becd4b182c1e"
      },
      "provenance": {
        "source_system_label": "stage-03-synthetic-corpus",
        "received_at": "2026-09-14T05:59:00Z"
      },
      "retention_class": "ephemeral_development"
    }
  ],
  "reports": [
    {
      "schema_version": "1.0",
      "report_id": "report-scan_clean",
      "subject_ref": "subject-synthetic-\u2014stage03-001",
      "source_document_id": "doc-scan_clean",
      "report_type": {
        "local_name": "Synthetic Urinalysis Panel"
      },
      "status": "final",
      "diagnostic_service_label": "Synthetic Laboratory",
      "specimen": {
        "source_text": "Urine"
      },
      "observation_ids": [
        "obs-scan_clean-01",
        "obs-scan_clean-02",
        "obs-scan_clean-03",
        "obs-scan_clean-04",
        "obs-scan_clean-05",
        "obs-scan_clean-06",
        "obs-scan_clean-07"
      ]
    }
  ],
  "observations": [
    {
      "schema_version": "1.0",
      "observation_id": "obs-scan_clean-01",
      "report_id": "report-scan_clean",
      "subject_ref": "subject-synthetic-\u2014stage03-001",
      "local_test_name": "SYNTH_PH",
      "status": "unknown",
      "mapping_status": "unmapped",
      "specimen": {
        "source_text": "Urine"
      },
      "result": {
        "kind": "quantity",
        "value": 6.0,
        "source_text": "6.0"
      },
      "verification": {
        "status": "unverified"
      },
      "data_quality": {
        "issues": []
      },
      "provenance": {
        "source_document_id": "doc-scan_clean",
        "source_locator": {
          "page": 1,
          "row_label": "SYNTH_PH",
          "field_label": "Result row",
          "raw_text": "SYNTH_PH | 6.0 | - | SYNTH_RANGE |"
        },
        "extraction_method": "ocr"
      },
      "source_reference_ranges": [
        {
          "range_id": "range-scan_clean-01",
          "origin": "source_report",
          "raw_text": "SYNTH_RANGE",
          "parsed": {
            "kind": "textual",
            "text": "SYNTH_RANGE"
          }
        }
      ]
    },
    {
      "schema_version": "1.0",
      "observation_id": "obs-scan_clean-02",
      "report_id": "report-scan_clean",
      "subject_ref": "subject-synthetic-\u2014stage03-001",
      "local_test_name": "SYNTH_PROTEIN",
      "status": "unknown",
      "mapping_status": "unmapped",
      "specimen": {
        "source_text": "Urine"
      },
      "result": {
        "kind": "categorical",
        "source_text": "Negative",
        "normalized_code": "negative"
      },
      "verification": {
        "status": "unverified"
      },
      "data_quality": {
        "issues": []
      },
      "provenance": {
        "source_document_id": "doc-scan_clean",
        "source_locator": {
          "page": 1,
          "row_label": "SYNTH_PROTEIN",
          "field_label": "Result row",
          "raw_text": "SYNTH_PROTEIN | Negative | - | Negative |"
        },
        "extraction_method": "ocr"
      },
      "source_reference_ranges": [
        {
          "range_id": "range-scan_clean-02",
          "origin": "source_report",
          "raw_text": "Negative",
          "parsed": {
            "kind": "categorical_expected",
            "expected_source_values": [
              "Negative"
            ]
          }
        }
      ]
    },
    {
      "schema_version": "1.0",
      "observation_id": "obs-scan_clean-03",
      "report_id": "report-scan_clean",
      "subject_ref": "subject-synthetic-\u2014stage03-001",
      "local_test_name": "SYNTH_LE",
      "status": "unknown",
      "mapping_status": "unmapped",
      "specimen": {
        "source_text": "Urine"
      },
      "result": {
        "kind": "ordinal",
        "source_text": "1+",
        "normalized_code": "1_plus",
        "rank": 2
      },
      "verification": {
        "status": "unverified"
      },
      "data_quality": {
        "issues": []
      },
      "provenance": {
        "source_document_id": "doc-scan_clean",
        "source_locator": {
          "page": 1,
          "row_label": "SYNTH_LE",
          "field_label": "Result row",
          "raw_text": "SYNTH_LE | 1+ | - | Negative | ABN"
        },
        "extraction_method": "ocr"
      },
      "source_reference_ranges": [
        {
          "range_id": "range-scan_clean-03",
          "origin": "source_report",
          "raw_text": "Negative",
          "parsed": {
            "kind": "categorical_expected",
            "expected_source_values": [
              "Negative"
            ]
          }
        }
      ],
      "source_interpretations": [
        {
          "raw_text": "ABN",
          "normalized_code": "abnormal"
        }
      ]
    },
    {
      "schema_version": "1.0",
      "observation_id": "obs-scan_clean-04",
      "report_id": "report-scan_clean",
      "subject_ref": "subject-synthetic-\u2014stage03-001",
      "local_test_name": "SYNTH_RBC",
      "status": "unknown",
      "mapping_status": "unmapped",
      "specimen": {
        "source_text": "Urine"
      },
      "result": {
        "kind": "interval",
        "low": 0.0,
        "high": 2.0,
        "source_text": "0-2",
        "unit_source": "/HPF",
        "unit_ucum": "/[HPF]"
      },
      "verification": {
        "status": "unverified"
      },
      "data_quality": {
        "issues": []
      },
      "provenance": {
        "source_document_id": "doc-scan_clean",
        "source_locator": {
          "page": 1,
          "row_label": "SYNTH_RBC",
          "field_label": "Result row",
          "raw_text": "SYNTH_RBC | 0-2 | /HPF | SYNTH_RANGE |"
        },
        "extraction_method": "ocr"
      },
      "source_reference_ranges": [
        {
          "range_id": "range-scan_clean-04",
          "origin": "source_report",
          "raw_text": "SYNTH_RANGE",
          "parsed": {
            "kind": "textual",
            "text": "SYNTH_RANGE"
          }
        }
      ]
    },
    {
      "schema_version": "1.0",
      "observation_id": "obs-scan_clean-05",
      "report_id": "report-scan_clean",
      "subject_ref": "subject-synthetic-\u2014stage03-001",
      "local_test_name": "SYNTH_WBC",
      "status": "unknown",
      "mapping_status": "unmapped",
      "specimen": {
        "source_text": "Urine"
      },
      "result": {
        "kind": "quantity",
        "value": 5.0,
        "comparator": "<",
        "source_text": "<5",
        "unit_source": "/HPF",
        "unit_ucum": "/[HPF]"
      },
      "verification": {
        "status": "unverified"
      },
      "data_quality": {
        "issues": []
      },
      "provenance": {
        "source_document_id": "doc-scan_clean",
        "source_locator": {
          "page": 1,
          "row_label": "SYNTH_WBC",
          "field_label": "Result row",
          "raw_text": "SYNTH_WBC | <5 | /HPF | SYNTH_RANGE |"
        },
        "extraction_method": "ocr"
      },
      "source_reference_ranges": [
        {
          "range_id": "range-scan_clean-05",
          "origin": "source_report",
          "raw_text": "SYNTH_RANGE",
          "parsed": {
            "kind": "textual",
            "text": "SYNTH_RANGE"
          }
        }
      ]
    },
    {
      "schema_version": "1.0",
      "observation_id": "obs-scan_clean-06",
      "report_id": "report-scan_clean",
      "subject_ref": "subject-synthetic-\u2014stage03-001",
      "local_test_name": "SYNTH_COLOR",
      "status": "unknown",
      "mapping_status": "unmapped",
      "specimen": {
        "source_text": "Urine"
      },
      "result": {
        "kind": "categorical",
        "source_text": "Yellow",
        "normalized_code": "yellow"
      },
      "verification": {
        "status": "unverified"
      },
      "data_quality": {
        "issues": []
      },
      "provenance": {
        "source_document_id": "doc-scan_clean",
        "source_locator": {
          "page": 1,
          "row_label": "SYNTH_COLOR",
          "field_label": "Result row",
          "raw_text": "SYNTH_COLOR | Yellow | - | - |"
        },
        "extraction_method": "ocr"
      }
    },
    {
      "schema_version": "1.0",
      "observation_id": "obs-scan_clean-07",
      "report_id": "report-scan_clean",
      "subject_ref": "subject-synthetic-\u2014stage03-001",
      "local_test_name": "SYNTH_NITRITE",
      "status": "unknown",
      "mapping_status": "unmapped",
      "specimen": {
        "source_text": "Urine"
      },
      "result": {
        "kind": "categorical",
        "source_text": "Negative",
        "normalized_code": "negative"
      },
      "verification": {
        "status": "unverified"
      },
      "data_quality": {
        "issues": []
      },
      "provenance": {
        "source_document_id": "doc-scan_clean",
        "source_locator": {
          "page": 1,
          "row_label": "SYNTH_NITRITE",
          "field_label": "Result row",
          "raw_text": "SYNTH_NITRITE | Negative | - | Negative |"
        },
        "extraction_method": "ocr"
      },
      "source_reference_ranges": [
        {
          "range_id": "range-scan_clean-07",
          "origin": "source_report",
          "raw_text": "Negative",
          "parsed": {
            "kind": "categorical_expected",
            "expected_source_values": [
              "Negative"
            ]
          }
        }
      ]
    }
  ]
}