{
  "schema_version": "1.0",
  "dataset_snapshot_id": "ds-scan_clean",
  "subject_ref": "unknown-subject",
  "created_at": "2026-09-14T06:00:00Z",
  "verification_status": "unverified",
  "source_documents": [
    {
      "schema_version": "1.0",
      "document_id": "doc-scan_clean",
      "media_type": "application/pdf",
      "integrity": {
        "sha256": "acc6c3ddb4c006706ffd75bcf66aad24115d604dc706a0b5b5d5becd4b182c1e"
      },
      "provenance": {
        "source_system_label": "stage-03-synthetic-corpus",
        "received_at": "2026-09-14T05:59:00Z"
      },
      "retention_class": "ephemeral_development"
    }
  ],
  "reports": [
    {
      "schema_version": "1.0",
      "report_id": "report-scan_clean",
      "subject_ref": "unknown-subject",
      "source_document_id": "doc-scan_clean",
      "report_type": {
        "local_name": "Synthetic Urinalysis Panel"
      },
      "status": "unknown",
      "diagnostic_service_label": "Synthetic Laboratory",
      "specimen": {
        "source_text": "Unknown"
      },
      "observation_ids": []
    }
  ],
  "observations": []
}